{"schema_version":"kaiba.provisioning.rpi5-eeprom-signing-result/v1alpha1","plan_id":"release:rpi5-prototype:8e9f1d5cd97f:eeprom","plan_digest":"sha256:a72e53c87e98bec574b3351de92860f2f179313f62a0b36faa88c1e6024089d3","release_intent_digest":"sha256:f95a2fca02cacac15eb4f8037a58443816dabfc5c34cce83c0e6959981ed5af1","eeprom_release_manifest_digest":"sha256:318dbaafa730aa25d655fdd89b29c5636c7dceb7e1a100e6ad7d8a22df79e1a5","signer_policy_digest":"sha256:c49608752c7aaf96da1976e174fb0e9f853b517bfc6df3a7f91f907ff9ca0db9","public_key_fingerprint":"sha256:0e68e7196fedc382ca435b995598e92d0fe36e4b1a1f949f85f5f2e6e2920fb9","customer_key_hash":"sha256:b8818acea4e71173903ee003e33ed37e969def7d2ea67bec15c0b73cb36c3895","source_date_epoch":1788139772,"updater_mode":"fresh-board","recovery_mode":"unsigned-copy","signatures":[{"role":"rpi5.eeprom_bootcode","input_digest":"sha256:a921f1c887fdb12b57a418404ea4656e8d0a522cec45ade28a3640c78c78c19d","input_size_bytes":25996,"signature_digest":"sha256:f255b87829dd83735f2ba87133b85fc5c460197f1fcdf9755ec8c02d230ae06d","signature_size_bytes":256,"gate_receipt_digest":"sha256:a371a61e22f151120afa190a3c64d18f15dd95a50dd4da73b4740f4b9eaf1a51"},{"role":"rpi5.eeprom_bootsys","input_digest":"sha256:c9d2101dbd5da8b79483e543f468df05ad841ce01b259e96eda6a03a370890e8","input_size_bytes":78344,"signature_digest":"sha256:4d5d1d9e67622c3dfadfc921b4eee3380ebb783fe8df04a1a37fc65fa9757189","signature_size_bytes":256,"gate_receipt_digest":"sha256:b1e9fd7315eca8bd1cc3150fb2b228f814a141db19e78b59172a7b3abad301d1"},{"role":"rpi5.eeprom_config","input_digest":"sha256:10340da1ad369ab2604ad549556a354c2ead0578342f0710cfea93717fe18dc3","input_size_bytes":57,"signature_digest":"sha256:face6d1fe7417bb360c05740f2b3f01999f97f3c98400040a2f9fc18f8bf2e70","signature_size_bytes":256,"gate_receipt_digest":"sha256:5462e470490ca5ff2a6049c8ff1a7e8844fae2d123b5c26c030dfa0befa02346"}],"signed_eeprom":{"digest":"sha256:d69f3454d838bd23bd9730ecbcebf0ca2f2353ceadca0d56abd2f54e1b82d19e","size_bytes":2097152},"eeprom_update_metadata":{"digest":"sha256:f638c4b2b35c2ae5695e85c4bf952b5e86b826ba15be7a854ea543b8b69f3edb","size_bytes":80},"fresh_recovery_bootcode":{"digest":"sha256:73dab9a01c139b7d995ac9a4055ee0d15551d7f8dbf1c2605bae584ef7126e0c","size_bytes":105396}}
